{
  "schema_version": "1.0",
  "issue_id": "5",
  "status": "review",
  "locked": false,
  "approved_at": null,
  "approved_by": null,
  "scope": [
    "受信機側 (receiver) の P2P 楽曲チャンク受信パイプラインを Domain / Data 層に新設する。送信機側 (sender) のロジックや Platform Channels との統合は Issue 範囲外とし、本 Issue ではチャンク列を受け取る純 Dart の抽象を定義する。",
    "Domain 層に以下の不変エンティティ + バリューオブジェクトを追加する: app/lib/domain/entities/track_transfer.dart に (a) TrackTransferManifest (chunkCount: int, totalBytes: int, sha256Hex: String 64hex, encryptionAlgo: String 例 'AES-GCM-256', mimeType: String, suggestedFileName: String, title: String, artist: String) と (b) TrackChunk (sequence: int >=0, payload: List<int>, isLast: bool)、(c) TrackTransferStatus enum (idle, receiving, verifying, decrypting, completed, abortedIntegrity, abortedDisconnected, abortedDuplicate)。",
    "Domain 層に IntegrityVerifier 抽象クラス (または mixin) を新設し、SHA-256 ベースの concrete impl Sha256IntegrityVerifier を実装する。入力は組み立て済み暗号文バイト列 (List<int>) と manifest.sha256Hex、出力は bool。dart:convert の sha256 (crypto package を pubspec に追加) を利用する。ハッシュ対象は 'manifest.sha256Hex が指す対象バイト列' とし、本 Issue では暗号化済み payload (transit ciphertext) を対象とする (受信した cipher が manifest と一致するかを検証する目的)。後続 Issue で plain hash への切替が必要になっても interface は変えずに implementation を差し替える。",
    "Domain 層に PayloadDecryptor 抽象クラスを新設し、AES-GCM 256-bit の concrete impl AesGcmPayloadDecryptor を実装する (cryptography package を pubspec に追加、または crypto パッケージに同等 API がある場合はそれを利用する)。入力は ciphertext (List<int>)、key (List<int> 32 bytes)、nonce (List<int> 12 bytes)、出力は plaintext (List<int>) または DecryptionFailure 例外。鍵 / nonce の供給は本 Issue では呼び出し側がパラメータで渡す形 (Issue #4 のセッション確立で導出される想定だが本 Issue ではそれをモック・スタブ化する)。",
    "Domain 層に ChunkTransport 抽象クラスを新設し、Stream<TrackChunk> として chunk を流す API を定義する。具体的な Bluetooth / nearby 実装は Issue 範囲外。本 Issue では FakeChunkTransport (List<TrackChunk> から Stream を発行する純 Dart) のみ実装し、テスト容易性を担保する。",
    "Data 層に TrackReceiver サービスを新設する (app/lib/data/services/track_receiver.dart)。コンストラクタで manifest, ChunkTransport, IntegrityVerifier, PayloadDecryptor, 受信先ファイル書き込み用 callback (typedef PersistEncrypted = Future<String> Function(List<int> ciphertext, TrackTransferManifest manifest) — 戻り値は保存先 filePath) を受け取る。`Stream<ReceiveProgress> receive()` を提供し (ReceiveProgress = receivedBytes, totalBytes, status, optionalError)、内部で (a) chunk を sequence 順に組み立て (out-of-order が来たら abortedIntegrity で終了)、(b) 全 chunk 受領後に IntegrityVerifier.verify、(c) 検証 OK なら PayloadDecryptor.decrypt、(d) plaintext バイト列を PersistEncrypted callback に渡す前に再度 PayloadEncryptor で暗号化…ではなく、本 Issue では『受信時に暗号化済みのまま保存する』方針 (manifest.encryptionAlgo は転送中暗号 = 保存時暗号と同一鍵スキーマで再利用) を取り、PersistEncrypted には ciphertext と manifest を渡す (= 復号は再生時 / Issue #6 で行う前提)。decrypt は『検証用に最初の 1 ブロックだけ試行して例外が出ないことを確認する preflight』として呼び、失敗時は abortedIntegrity 終了。",
    "Data 層に DuplicateTrackDetector 抽象 + InMemoryDuplicateTrackDetector concrete を追加する (app/lib/data/services/duplicate_track_detector.dart)。manifest.sha256Hex を集合で保持し isDuplicate(sha256Hex) と record(sha256Hex) を提供。TrackReceiver は受信開始前に isDuplicate を確認し、重複の場合は abortedDuplicate ステータスで Stream を即終了し PersistEncrypted を呼ばない。",
    "TrackReceiver は転送中に ChunkTransport.stream が onDone より前に onError で切れた場合、abortedDisconnected ステータスを最後の ReceiveProgress として emit してから Stream を close する。",
    "ReceiveProgress は status と (sequence ベースではなく) bytes ベースの進捗を含み、各 chunk 受信ごとに 1 イベント emit する (1 秒以内更新の spec 受け入れ基準を満たす土台)。",
    "新規追加された Domain / Data クラスへの import は層ルールを守る: domain/ は flutter / flutter_riverpod / just_audio / go_router を import しない。data/ は flutter/material / go_router を import しない。crypto / cryptography パッケージは Domain (アルゴリズム抽象は Data 寄り) ではなく Data 層側で import するか、Domain 抽象は List<int> in/out のみで暗号 API を露出しない設計とする。",
    "pubspec.yaml に crypto: ^3.0.3 と cryptography: ^2.7.0 (または同等バージョン) を追加し、`flutter pub get` が成功する状態にする。",
    "新規 Domain / Data コードに対してユニットテストを追加する。テストは flutter_test のみで完結し (実機 / Platform Channels 不要)、FakeChunkTransport を使って受信フロー全体を検証する。",
    "既存 lib/ コードへの変更は『import 並び替え + 新規ファイル追加 + pubspec 追記』のみ。既存 main.dart / app.dart / dashboard_page.dart / player_page.dart / mini_player.dart / providers.dart / audio_service.dart / track.dart のロジックは変更しない (機能 6 以降で TrackReceiver を Riverpod Provider 経由で wire up するのは別 Issue)。",
    "init.sh / .github/workflows/flutter-ci.yml / docs/PIPELINE.md / .harness/* / bin/* / hooks/* は触らない (harness は Sprint 01 の成果物として固定)。"
  ],
  "out_of_scope": [
    "送信機側 (sender) の chunk 分割・暗号化・送信ロジック (本 Issue は受信機側のみ)。",
    "Bluetooth / nearby / Platform Channels の concrete 実装 (FakeChunkTransport のみ提供、実装は Issue #3 完了後の別 Issue で接続)。",
    "Issue #4 の SessionTransport / SessionId 抽象との結線 (Issue #4 は別ブランチで未マージ。本ブランチは main からの fork のため SessionTransport は import しない。後続 Issue で adapter を書く)。",
    "受信完了楽曲の即時再生 / 自動再生キューイング (Issue #6 の範囲)。",
    "受信楽曲ライブラリ UI / 一覧表示 / お気に入りフィルタ (Issue #9 の範囲)。",
    "ストレージ上限を超えた場合の最古非お気に入り削除ロジック (Issue #9 の範囲)。本 Issue は『PersistEncrypted callback に ciphertext を渡す』ところまでで、削除戦略は呼び出し側に委ねる。",
    "暗号鍵 / nonce の交換プロトコル (Issue #4 の範囲)。本 Issue ではテスト時に直接バイト列を流し込む。",
    "再生時の復号 (Issue #6 で AudioService 拡張時に扱う)。本 Issue では復号関数の preflight 呼び出しのみ実装。",
    "Riverpod Provider への wire up (Issue #6 / #9 の範囲)。",
    "permission_handler / flutter_secure_storage / sqflite 等の追加パッケージ導入 (Issue #2 / #9 で扱う)。",
    "既存テスト (test/widget_test.dart, test/domain/track_test.dart) のアサーション改変・スキップ追加・削除 (test-integrity スキルで禁止)。既存テストの import 更新も本 Issue では不要 (新規ファイル追加のみで対応する)。",
    "UI 文言・カラー・テーマ変更 (Issue #5 は受信パイプラインの裏側のみ、UI 変更なし)。"
  ],
  "success_criteria": [
    "app/lib/domain/entities/track_transfer.dart が存在し、`grep -E 'class TrackTransferManifest' app/lib/domain/entities/track_transfer.dart` が 1 件以上、`grep -E 'class TrackChunk' app/lib/domain/entities/track_transfer.dart` が 1 件以上、`grep -E 'enum TrackTransferStatus' app/lib/domain/entities/track_transfer.dart` が 1 件以上ヒットする。",
    "TrackTransferManifest は次の 8 フィールドを final で持つ: chunkCount (int), totalBytes (int), sha256Hex (String), encryptionAlgo (String), mimeType (String), suggestedFileName (String), title (String), artist (String)。`grep -E 'final (int|String) (chunkCount|totalBytes|sha256Hex|encryptionAlgo|mimeType|suggestedFileName|title|artist)' app/lib/domain/entities/track_transfer.dart | wc -l` の出力が 8 以上。",
    "TrackTransferStatus enum は次の 8 値を含む: idle, receiving, verifying, decrypting, completed, abortedIntegrity, abortedDisconnected, abortedDuplicate。`grep -E '\\b(idle|receiving|verifying|decrypting|completed|abortedIntegrity|abortedDisconnected|abortedDuplicate)\\b' app/lib/domain/entities/track_transfer.dart | wc -l` の出力が 8 以上。",
    "app/lib/domain/services/integrity_verifier.dart が存在し、`abstract class IntegrityVerifier` と `class Sha256IntegrityVerifier implements IntegrityVerifier` の両方が grep で見つかる。",
    "app/lib/domain/services/payload_decryptor.dart が存在し、`abstract class PayloadDecryptor` と `class AesGcmPayloadDecryptor implements PayloadDecryptor` の両方が grep で見つかる。",
    "app/lib/domain/services/chunk_transport.dart が存在し、`abstract class ChunkTransport` と `class FakeChunkTransport implements ChunkTransport` の両方が grep で見つかる。FakeChunkTransport の Stream は List<TrackChunk> を順に emit し、optional に Exception を最後に投げて切断シナリオをシミュレートできる。",
    "app/lib/data/services/track_receiver.dart が存在し、`class TrackReceiver` が定義され、`Stream<ReceiveProgress> receive()` メソッドを持つ。",
    "app/lib/data/services/duplicate_track_detector.dart が存在し、`abstract class DuplicateTrackDetector` と `class InMemoryDuplicateTrackDetector implements DuplicateTrackDetector` の両方が grep で見つかる。",
    "app/pubspec.yaml の dependencies セクションに crypto: と cryptography: の 2 つが追加されている。`grep -E '^\\s+(crypto|cryptography):' app/pubspec.yaml | wc -l` の出力が 2 以上。",
    "app/lib/domain/ 配下の新規ファイルは flutter / flutter_riverpod / just_audio / go_router を import しない。`grep -REn \"^import 'package:(flutter/|flutter_riverpod|just_audio|go_router)\" app/lib/domain/` の出力が 0 件 (= 既存 track.dart の制約と整合)。",
    "app/lib/data/ 配下の新規ファイルは flutter/material / go_router を import しない。`grep -REn \"^import 'package:(flutter/material|go_router)\" app/lib/data/` の出力が 0 件。",
    "新規ユニットテスト app/test/data/track_receiver_test.dart が存在し、最低 7 ケース以上を含む (`grep -cE \"^\\s*test\\(\" app/test/data/track_receiver_test.dart` が 7 以上)。具体的には (a) 正常系: chunk 順次受信→検証→preflight 復号→PersistEncrypted 呼び出し→completed status、(b) 整合性失敗: manifest.sha256Hex と組立て後ハッシュが不一致 → abortedIntegrity、(c) 復号失敗: AES-GCM 鍵不正 → abortedIntegrity、(d) 切断: ChunkTransport が onError → abortedDisconnected、(e) 重複: DuplicateTrackDetector.isDuplicate=true → abortedDuplicate (PersistEncrypted は呼ばれない)、(f) 進捗 emit: 各 chunk 受信ごとに ReceiveProgress.receivedBytes が単調増加、(g) 順序破壊: sequence が飛んだ chunk を流すと abortedIntegrity の 7 観点。",
    "新規ユニットテスト app/test/domain/track_transfer_test.dart が存在し、TrackTransferManifest / TrackChunk / TrackTransferStatus の equality / 値保持を検証するケースを 3 件以上含む (`grep -cE \"^\\s*test\\(\" app/test/domain/track_transfer_test.dart` が 3 以上)。",
    "新規ユニットテスト app/test/domain/integrity_verifier_test.dart が存在し、Sha256IntegrityVerifier に対し (a) 正しいハッシュで true、(b) 1 byte 改竄で false、(c) 空バイト列で sha256 of empty (e3b0c44...) と一致して true、の 3 ケースを最低限含む。`grep -cE \"^\\s*test\\(\" app/test/domain/integrity_verifier_test.dart` が 3 以上。",
    "新規ユニットテスト app/test/domain/payload_decryptor_test.dart が存在し、AesGcmPayloadDecryptor に対し (a) 正しい key/nonce/ciphertext で plaintext 復元、(b) 1 bit 改竄 ciphertext で例外、(c) 不正 key で例外、の 3 ケースを最低限含む。`grep -cE \"^\\s*test\\(\" app/test/domain/payload_decryptor_test.dart` が 3 以上。",
    "Flutter SDK が利用可能な環境で `cd app && flutter test` が exit 0 で 'All tests passed' を含む。SDK 不在 container では .github/workflows/flutter-ci.yml の最新 run が緑であることで代替確認とする。テスト合計件数は 既存 6 件 (Issue #1 由来) + 新規 16 件以上 (track_receiver 7 + track_transfer 3 + integrity_verifier 3 + payload_decryptor 3) = 22 件以上。",
    "Flutter SDK が利用可能な環境で `cd app && flutter analyze` が exit 0 で 'No issues found' を含む (新規追加コードに analyzer 警告がない)。",